{
  "schemaVersion": "1.2.0",
  "generatedUtc": "2026-04-13T16:52:52Z",
  "profile": "standard",
  "current": {
    "timestampUtc": "2026-04-13T16:52:52Z",
    "overall": 85,
    "maturity": "GOLD"
  },
  "risk": {
    "score": 85,
    "maturity": "GOLD",
    "posture": "MODERATE"
  },
  "lastN": [
    85
  ],
  "runCount": 1,
  "averageScore": 85,
  "bestScore": 85,
  "worstScore": 85,
  "categories": [
    {
      "name": "storage",
      "raw": 75,
      "weight": 35,
      "weighted": 26,
      "max": 100,
      "grade": ""
    },
    {
      "name": "workload",
      "raw": 100,
      "weight": 20,
      "weighted": 20,
      "max": 100,
      "grade": ""
    },
    {
      "name": "config",
      "raw": 100,
      "weight": 15,
      "weighted": 15,
      "max": 100,
      "grade": ""
    },
    {
      "name": "backup",
      "raw": 80,
      "weight": 30,
      "weighted": 24,
      "max": 100,
      "grade": ""
    },
    {
      "name": "overall",
      "raw": 85,
      "weight": 1,
      "weighted": 85,
      "max": 100,
      "grade": ""
    }
  ]
}